name,host_id,host_name,neighbourhood,room_type,price,minimum_nights,number_of_reviews,last_review,reviews_per_month,calculated_host_listings_count,availability_365,number_of_reviews_ltm,license
"Bonito piso a 200m de la playa, El Palo (Málaga)",510467,Rafael,Este,Entire home/apt,58.0,3,274,2025-09-29,1.88,1,324,40,ESFCTU0000290200003588210000000000000000VUT/MA/220430
Perfect Location In Malaga,793360,Fred,Este,Private room,28.0,5,102,2025-03-27,0.59,5,288,3,
Malaga Lodge Guesthouse Double room-shared bath.,1687526,Mayte,Centro,Private room,60.0,1,68,2025-09-04,0.41,6,64,12,ESHFTU0000290200004234200060000000000000VFT/MA/122402
NEW APARTMENT IN MALAGA CENTER,1725690,Carlos,Centro,Entire home/apt,61.0,3,322,2025-09-09,2.11,1,297,38,VFT/MA/02334
Casa La Maga - Apartment for happy people,1526932,Cristina,Centro,Entire home/apt,87.0,2,405,2025-07-27,2.48,1,195,23,VFT/MA/02288
Apartment historical centre Malaga,2055304,Michael,Centro,Entire home/apt,78.0,4,52,2025-09-03,0.33,1,276,15,CTC-2023053184
LUXURY MALAGA HISTORIC CENTER BEACH,2092252,Juliette,Centro,Entire home/apt,71.0,5,109,2025-08-19,0.67,13,360,5,H
Duplex Apartment in Malaga Center,2489890,Fede,Centro,Entire home/apt,86.0,4,243,2025-09-10,1.51,13,63,12,ESFCTU0000290270005647710000000000000000VUT/MA/006430
Duplex Apartment. Malaga Center,2489890,Fede,Centro,Entire home/apt,72.0,4,216,2025-08-24,1.34,13,63,19,ESFCTU0000290270005647640000000000000000VUT/MA/006418
Modern Apartment in Malaga Center,2489890,Fede,Centro,Entire home/apt,57.0,3,259,2025-09-07,1.61,13,68,18,ESFCTU0000290270005647570000000000000000VFT/MA/005760
Modern Apartment. Malaga City Centre,2489890,Fede,Centro,Entire home/apt,57.0,4,250,2025-09-08,1.56,13,68,17,VUT/MA/00574
"MALAGA CENTER, MALAGUETA BEACH",2707228,Alfonso,Centro,Entire home/apt,86.0,5,105,2025-08-28,0.7,5,110,7,VFT/MA/672
3 bed penthouse in the Plaza de la Constitución,2840633,Carolina,Centro,Entire home/apt,272.0,2,313,2025-05-23,2.08,1,306,5,VFT/MA/0032
"Spacious, central & bath en suite",2986899,Andrés,Centro,Private room,40.0,2,498,2025-09-26,3.11,2,30,46,VFT/MA/08683
Atico diáfano en centro de Málaga,3029584,Javier - Cap,Centro,Entire home/apt,89.0,3,229,2025-09-26,1.56,1,246,19,VFT/MA/00239
Beach Front Apartment in Málaga,2489890,Fede,Este,Entire home/apt,111.0,5,90,2025-07-17,0.59,13,78,5,ESFCTU0000290200000192100000000000000000VFT/MA/005731
Golf next to the beach and ideal Telecommuting,3301281,Mariano,Churriana,Entire home/apt,81.0,2,96,2025-08-25,0.71,4,305,10,VFT/MA/01571
Málaga Downtown next to La Merced Square!,3764491,Alicia,Centro,Entire home/apt,71.0,2,24,2025-08-22,0.21,1,319,3,CTC 2019087257
Apartamento en la Malagueta - Puerto de Málaga,3899104,Alejandro,Centro,Entire home/apt,72.0,4,268,2025-08-23,1.82,1,65,24,ESFCTU0000290200002612130000000000000000VFT/MA/01057
AUNT ANTONIA BEACH HOUSE 2ND FLOOR,3912651,Juan Francisco,Este,Entire home/apt,117.0,2,27,2025-08-12,0.18,3,247,3,ESFCTU0000290200007516600000000000000000VFT/MA/361242
AUNT ANTONIA BEACH HOUSE 1ST FLOOR,3912651,Juan Francisco,Este,Entire home/apt,135.0,2,48,2025-09-13,0.32,3,169,4,ESFCTU0000290200007516530000000000000000VFT/MA/268185
AUNT ANTONIA BEACH HOUSE STREET LEVEL,3912651,Juan Francisco,Este,Entire home/apt,158.0,4,24,2025-02-08,0.16,3,206,1,ESFCTU0000290200007516460000000000000000VFT/MA/362090
Great Apartment in the heart of Malaga,3301281,Mariano,Centro,Entire home/apt,176.0,2,330,2025-08-25,2.13,4,319,32,VFT/MA/00436
Recharge your Batteries in Malaga-La Yuca,5430318,Benno,Este,Entire home/apt,98.0,4,15,2025-06-06,0.1,3,249,1,VFT/MA/08407
Apartment in the historical center,5527354,Asyr Asesores S L,Centro,Entire home/apt,130.0,3,175,2025-09-29,1.16,1,180,5,VFT/MA/00109
Enjoy Malaga with top comfort Spot,5430318,Benno,Centro,Entire home/apt,147.0,4,59,2025-09-14,0.4,3,162,7,VFT/MA/03034
PRETTY DOUBLE ROOM WITH BALCONY,617998,Valle,Este,Private room,29.0,7,77,2025-08-31,0.51,1,314,6,VFT/MA/09354
HEART HISTORICAL CITY. Santos street,5895070,Miren Arantza,Centro,Entire home/apt,63.0,5,295,2025-09-28,1.99,3,350,28,
"Apartamento 3 dormitorios, a 5 minutos de la playa",4841998,Emilia Y Pepe,Carretera de Cadiz,Entire home/apt,203.0,1,20,2025-08-17,0.15,4,242,3,VFT/MA/01635
Private room double bed on the beach,6380806,Enky,Este,Private room,45.0,1,250,2025-09-05,1.66,2,293,32,CTC-2018176380
Attic in the historic center of Malaga,7222872,Ana,Centro,Entire home/apt,102.0,4,227,2025-06-09,1.54,2,65,8,VFT/MA/01535  // nº registro único alquiler de corta duración: ESFCTU0000290270004444480000000000000000VUT/MA/015355
Habitación en Cozy B&B Close train&bus station,5268527,Andreina,Centro,Private room,37.0,3,405,2025-09-12,2.73,1,305,47,Registro de turismo Andalucia                VFT/MA/02084
Beachfront 4 bedrooms apartment free parking,7378338,Mercedes,Carretera de Cadiz,Entire home/apt,240.0,5,125,2025-09-01,0.85,1,221,9,ESFCTU0000290220002550250000000000000000VFT/MA/026796
BEST LOCATION+WIFI- CITY CENTRE,5895070,Miren Arantza,Centro,Entire home/apt,76.0,5,271,2025-09-10,1.84,3,325,22,
"Duplex Playa Pedregalejo Málaga ""La Jábega""",7506832,Lucía,Este,Entire home/apt,85.0,6,54,2025-09-16,0.37,1,109,8,VFT/MA/59138
7 minutos estación de tren y playa.,7573364,Maria,Carretera de Cadiz,Entire home/apt,80.0,5,104,2025-09-19,0.71,1,14,52,ESFCTU0000290220005760210000000000000000VUT/MA/013366
Best place in the historic city center of Malaga,7723499,Jesus,Centro,Entire home/apt,86.0,4,191,2025-09-15,1.34,4,352,20,ESFCTU0000290200006245440000000000000000VUT/MA/037708
"APARTAMENTO CENTRO HISTORICO,  DOS BAÑOS Y WIFI",7779962,Isabel,Centro,Entire home/apt,85.0,3,46,2025-08-19,0.32,1,233,10,ESFCTU0000290270004860730000000000000000VFT/MA/009243
Jilton Beach,1018008,Alfonso,Carretera de Cadiz,Private room,74.0,2,119,2025-09-01,1.07,1,1,31,VFT/MA/08221
Studio and New Terrace at the City Center,8083402,Regina,Centro,Entire home/apt,83.0,6,234,2025-08-27,1.59,2,37,8,VFT/MA/24385
DelCarmen Premium Beach Apartment Seaviews Parking,4921828,Laura,Este,Entire home/apt,90.0,3,147,2025-08-03,2.3,1,112,11,VFT/MA/10357
Private room close to  beach in shared apartamet,6380806,Enky,Este,Private room,45.0,1,287,2025-09-05,1.97,2,293,20,CTC-2018176380
Trendy apartment with intimite big terrace,6818242,Nadine,Centro,Entire home/apt,144.0,4,250,2025-09-11,1.77,1,209,27,CTC-2018115175
Centro Histórico Málaga WIFI,8544512,Malaga Center Flat,Centro,Entire home/apt,76.0,1,178,2025-05-08,1.22,59,347,11,VFT/MA/00001
Bonito Apt en el Centro Histórico (Malama B3),11420357,Nadia,Centro,Entire home/apt,67.0,7,170,2025-06-21,1.18,3,214,18,A/MA/01266
Apartamento nuevo cerca de la playa,9552973,Eugenio,Carretera de Cadiz,Entire home/apt,53.0,2,65,2025-09-29,0.45,2,240,12,VFT/MA/02018
Estudio Málaga Centro - Playa,10071753,Javier,Centro,Entire home/apt,68.0,4,216,2025-09-17,1.93,1,126,31,ESFCTU0000290200006582110000000000000000VFT/MA/206121
Perfect Location in Malaga Part 2,793360,Fred,Este,Private room,28.0,5,50,2025-02-25,0.35,5,288,1,
Perfect Location in Malaga Part 3,793360,Fred,Este,Private room,28.0,5,54,2025-06-01,0.38,5,288,4,CTC-2018118027
"Best location in Malaga, just by the beach",10985439,Helle,Este,Entire home/apt,193.0,3,30,2025-08-10,0.22,1,357,1,VFT/MA/47851
Lovely flat Parking  free Old Town B2,9744958,Ana,Centro,Entire home/apt,69.0,4,458,2025-09-15,3.3,2,323,33,ESFCTU0000290270005119420000000000000000VFT/MA/003047
Malaga Dreams Oldtown Free Parking by Easytrip,11104098,Carmen,Centro,Entire home/apt,79.0,4,103,2025-08-24,0.73,1,314,5,VFT/MA/00711
perfect Location,2426898,Diaz Jose Manuel,Centro,Entire home/apt,67.0,4,45,2025-06-28,0.35,1,22,13,
"Heart of Malaga - Your Home, Fully Equipped",11689519,Valentina E Lorenzo,Centro,Entire home/apt,135.0,2,151,2025-03-24,1.09,1,238,2,VFT/MA/03803
"Best Location, Real City center.Cozy & quiet Loft",11778619,Arantxa,Centro,Entire home/apt,90.0,5,233,2025-08-29,1.67,14,172,24,VFT/MA/13362
Casas Penthouse FreshApartments,3376700,Freshlanding,Centro,Entire home/apt,150.0,1,114,2025-07-13,0.81,59,303,10,VFT/MA/04352; ESFCTU0000290200006809600000000000000000VFT/MA/043524
Lovely apartment in the center VFT/MA/00204,11931754,Frédéric C,Centro,Entire home/apt,67.0,6,819,2025-09-18,5.83,2,239,56,VFT/MA/00204
Nice Flat in the center VFT/MA/00202,11931754,Frédéric C,Centro,Entire home/apt,58.0,6,900,2025-09-19,6.41,2,191,59,VFT/MA/00202
1 Amazing Double/Triple  Room City Center,5490522,Fali,Centro,Private room,49.0,1,332,2025-09-15,2.36,13,22,36,VFT / 06609
2 Amazing Room Next to Picasso House,5490522,Fali,Centro,Private room,43.0,4,330,2025-09-12,2.34,13,26,28,VFT / 06609
4 Amazing Double Room AACC & WIFI,5490522,Fali,Centro,Private room,42.0,1,304,2025-09-12,2.15,13,29,25,VFT/06609
5 Amazing Purple Double Room AACC + WIFI,5490522,Fali,Centro,Private room,40.0,2,305,2025-09-15,2.16,13,29,26,VFT / 06609
Central Unique XIX Century Apartment,12202265,Rafael,Centro,Entire home/apt,241.0,4,250,2025-09-28,1.81,1,307,27,VFT/MA/06767
"The Gardener's Cottage Malaga, Andalusia",12505395,Juan Carlos,Este,Entire home/apt,90.0,3,31,2025-07-11,0.27,3,339,3,VTAR/MA/014
Enjoy sunshine @designer duplex w/ terrace+parking,10010991,Eva,Centro,Entire home/apt,201.0,2,288,2025-09-23,2.92,1,241,12,ESFCTU0000290200004285790000000000000000VFT/MA/133337
Estudio Centro Histórico WIFI,8544512,Malaga Center Flat,Centro,Entire home/apt,83.0,1,65,2025-09-09,0.49,59,339,14,VFT/MA/10319
Attic Terrace Central Location AC,4884962,"Esther, Francisco & Sara",Centro,Entire home/apt,69.0,1,130,2025-07-16,0.93,8,211,4,VFT/MA/02134
Amazing private terrace for ideal city trip,12828040,Christine,Centro,Entire home/apt,85.0,7,264,2025-09-22,1.89,1,175,16,ESFCTU0000290270004725880000000000000000VUT/MA/013685
Dúplex con terraza en Málaga,13172203,Marta,Centro,Entire home/apt,118.0,2,236,2025-07-21,1.71,4,148,7,VFT/MA/01913
Downtown Apartment.,6429584,Blanca,Centro,Entire home/apt,78.0,2,110,2025-08-31,0.92,1,293,24,VFT/MA//12633
Beautiful single-villa private pool,13555160,Maite,Puerto de la Torre,Entire home/apt,219.0,4,144,2025-09-16,1.06,1,301,16,VFT/MA/13261
Beach apartment with Breathtaking seaviews,13627093,José Antonio,Este,Entire home/apt,111.0,7,74,2025-09-19,0.54,2,163,8,ESFCTU0000290200002547100000000000000000VFT/MA/018492
Granada 1 FreshApartments,6788392,Pepe Y Ana,Centro,Entire home/apt,87.0,1,237,2025-09-12,1.72,3,332,7,VFT/MA/24785; ESFCTU0000290200007598710000000000000000VFT/MA/247852
Amazing ROOM ON ROOF TERRACE FREE WIFI,5490522,Fali,Centro,Private room,25.0,2,394,2025-09-09,2.86,13,11,37,VFT / 06609
Historical City Center-Santos St-Warm & Peaceful,11778619,Arantxa,Centro,Entire home/apt,81.0,5,260,2025-09-28,1.9,14,293,40,RTA:  VFT/MA/03965
Malaga close to the beach,3025868,Emilia Matilde,Este,Entire home/apt,157.0,3,57,2025-08-21,0.42,1,148,8,vft/MA/01933
PICASSO VIEWPOINT / NEXT TO THE SEA,15535210,Carmen Y Muni,Centro,Entire home/apt,126.0,2,724,2025-09-22,5.26,2,153,102,CTC-2016095796
Bonito apartamento con terraza y WIFI gratis,15780021,Alvaro,Este,Entire home/apt,79.0,3,131,2025-08-31,0.95,4,118,18,
PENTHOUSE SEAVIEW. Malaga Center Flat,8544512,Malaga Center Flat,Centro,Entire home/apt,210.0,1,199,2025-09-08,1.45,59,278,20,VFT/MA/03848
"Casa Noah, villa con piscina privada",610685,Rafael,Puerto de la Torre,Entire home/apt,171.0,5,56,2025-09-14,0.41,1,312,17,CTC-2016074884
Gran loft para 6 personas. WIFI y vistas al mar,15780021,Alvaro,Centro,Entire home/apt,68.0,3,70,2025-08-24,0.55,4,99,10,
Habitación matrimonio naranja VFT/MA/09571,16411274,Rafael,Teatinos-Universidad,Private room,21.0,1,58,2025-09-01,0.52,5,91,8,ESHFTU00002902600019894800300000000000000000000000080VFT/MA/09571
"LUXURY HOME "" WITH TERRACE """,10147055,Vasyl,Carretera de Cadiz,Entire home/apt,105.0,1,223,2025-09-14,1.63,4,114,21,ESFCTU000029022000600597000000000000000000A/MA/017739
Apartamento Económico por Semanas 1,16650042,R.U Sto Tomas,Teatinos-Universidad,Entire home/apt,36.0,10,43,2025-09-03,0.35,11,68,5,A/MA/01590
"Sea views villa in Malaga with pool,air con+wifi",16656041,Robert,Este,Entire home/apt,638.0,3,85,2025-08-29,0.64,2,359,8,VFT/MA/00979
Apto 1ª linea playa y céntrico,16744914,Mari Paz,Centro,Entire home/apt,82.0,3,87,2025-09-03,0.81,1,84,10,CTC-2016105693
Malaga center : room with terrace,16901356,Daniel,Centro,Private room,40.0,5,318,2025-09-24,2.36,1,125,27,ESFCTU0000290270005643510000000000000000VFT/MA/118873
Great & Calm Apartment City Center.-Fully Equipped,14077041,Christian,Centro,Entire home/apt,80.0,4,214,2025-09-21,1.59,1,294,17,VFT/MA/01983
New Luxury Premium,17589912,Antonio / Manuel,Centro,Entire home/apt,249.0,1,184,2025-09-22,1.38,4,255,17,ESFCNT00002902000015033300000000000000000000000000007
Granada 3 FreshApartments,6788392,Pepe Y Ana,Centro,Entire home/apt,87.0,1,201,2025-08-24,1.48,3,323,13,VFT/MA/24790; ESFCTU0000290200007598950000000000000000VFT/MA/247902
Amplio piso en barriada la luz,17971688,Marivi,Carretera de Cadiz,Entire home/apt,72.0,3,66,2025-09-28,0.49,1,215,9,CTC-2018205957
Apartamento en la mejor ubicación  3ie,17585280,Pablo Y Marisa,Centro,Entire home/apt,117.0,1,176,2025-05-04,1.3,15,344,12,ESFCTU000029027000011343000000000000000000A/MA/013342
APARTMENT RIGHT ON THE BEACH,18655665,Adolfo,Centro,Entire home/apt,75.0,2,372,2025-09-13,2.75,1,58,46,VTF/MA/02622
Nice flat with 2 bedrooms,18760636,Carmen,Centro,Entire home/apt,90.0,120,9,2025-06-22,0.07,1,103,1,
Habitacion nº 3 VFT/MA/09571,16411274,Rafael,Teatinos-Universidad,Private room,28.0,1,59,2025-09-01,0.44,5,62,10,ESHFTU00002902600019894800300000000000000000000000080
HABITACION TRIPLE VFT/MA/09571,16411274,Rafael,Teatinos-Universidad,Private room,20.0,1,70,2025-08-29,0.52,5,62,12,ESHFTU00002902600019894800300000000000000000000000080VFT/MA/09571
Habitación primera con terraza VFT/MA/09571,16411274,Rafael,Teatinos-Universidad,Private room,25.0,1,54,2025-08-31,0.44,5,92,13,VFT/MA/09571 ESHFTU00002902600019894800100000000000000000000000082
Ático en el centro de Málaga,11880556,Luis Vicente,Centro,Entire home/apt,114.0,2,96,2025-08-22,0.71,1,359,8,CTC-2018168473
Piso 5 min. centro histórico,243076559,Juan Manuel,Centro,Entire home/apt,210.0,2,109,2025-09-28,0.81,1,360,3,201399901312939
Apartamento  Centro Histórico 2,20326063,Ernesto,Centro,Entire home/apt,81.0,5,141,2025-09-02,1.08,4,287,24,VTF/MA/15335
New House  Malaga Costa del Sol,12505395,Juan Carlos,Este,Entire home/apt,113.0,3,93,2025-07-22,0.73,3,296,4,VTAR/MA/014
"Cozy Penthouse Malaga Center, car park included",453777166,Francisco Andres,Centro,Entire home/apt,99.0,1,359,2025-09-22,2.83,28,338,31,VFT/MA/04137
Loft Apartment in El Candado Malaga,17556274,Fernando,Este,Entire home/apt,63.0,3,128,2025-09-19,0.96,5,110,28,ESHFTU0000290200002466090010000000000000VFT/MA/279363
"Cozy & sunny penthouse    terrace, parking free",9744958,Ana,Centro,Entire home/apt,95.0,4,535,2025-09-05,4.04,2,317,66,ESFCTU0000290270005119730000000000000000VFT/MA/003058
Buhardilla en centro histórico,21115381,Pedro,Centro,Entire home/apt,87.0,4,88,2025-08-23,0.9,1,267,4,VFT/MA/17335
Prime Location in Málaga – 15 Min Walk to Old Town,8328696,Alvaro,Centro,Entire home/apt,66.0,2,165,2025-09-04,1.6,2,346,13,
Del Parque Flats Letran,21176876,"Del Parque Flats, S.L.",Centro,Entire home/apt,61.0,1,277,2025-08-12,2.06,1,213,6,ESFCTU0000290270004764250000000000000000VUT/MA/291599
Cozy & quiet apartment in the center,21352724,Mireia,Centro,Entire home/apt,59.0,1,171,2025-09-11,1.67,1,238,47,VFT/MA/09455
Nice & romantic Penthouse Center,12379609,Carmen,Centro,Entire home/apt,57.0,2,477,2025-09-11,3.59,2,96,49,VFT/MA/23360
Apartamento centro de Málaga,21924783,Eduardo,Centro,Entire home/apt,97.0,3,372,2025-09-12,2.79,1,92,25,VFT/MA/29489
In front of the beach...,22289428,Carolina,Centro,Entire home/apt,91.0,3,302,2025-09-12,2.31,1,50,24,VFT/MA/03843
Apartamento Centro Histórico 1,20326063,Ernesto,Centro,Entire home/apt,81.0,5,135,2025-09-22,1.04,4,245,29,VTF/MA/15335
Room with  Art,8562094,Mersi,Este,Private room,45.0,1,371,2025-09-20,2.9,1,353,21,Exempt
Quiet Apartment Historical Center 1,22835439,Bruno,Centro,Entire home/apt,95.0,2,70,2025-07-27,0.53,16,176,7,A/MA/01382
Artistic Apartment in Picasso Neigh,12439454,Diego José,Centro,Entire home/apt,70.0,3,449,2025-09-22,3.46,1,244,47,VFT/MA/09114
Apartamento luminoso en el centro,19957169,Comam,Centro,Entire home/apt,83.0,1,220,2025-09-05,1.76,7,193,7,VUT/MA/03081
Wonderfull flat whith views. Centre,23844711,José Manuel,Centro,Entire home/apt,66.0,3,155,2025-09-13,1.19,2,304,15,VFT/MA/18532
MALAGA HISTORICAL CENTRE (SOHO),6141117,Jose,Centro,Entire home/apt,120.0,6,16,2025-07-23,0.13,1,221,3,Vft/ma/01558
Cozy Apartament in the heart of Málaga with Pool,17556274,Fernando,Centro,Entire home/apt,65.0,3,185,2025-09-27,1.79,5,203,28,ESFCTU0000290270005756090000000000000000VUT/MA/130144
"Studio, Marqués de Guadiaro",23613433,Marqués De Guadiaro,Centro,Entire home/apt,101.0,2,78,2025-05-28,0.63,7,351,5,A/MA/01275
BRIGHT STUDIO-ESPECERIA STREET,11778619,Arantxa,Centro,Entire home/apt,63.0,5,289,2025-09-22,2.21,14,286,26,VFT/MA/13362
Sunny flat with Parking  free Old Town,14922045,Jorge,Centro,Entire home/apt,67.0,4,391,2025-09-15,2.97,3,319,37,ESFCTU0000290270005119590000000000000000VUT/MA/002098
Apart. 1 Bdr.  Marqués de Guadiaro,23613433,Marqués De Guadiaro,Centro,Entire home/apt,117.0,2,55,2025-05-03,0.44,7,365,3,A/MA/01275
"Penthouse, Marqués de Guadiaro",23613433,Marqués De Guadiaro,Centro,Entire home/apt,172.0,2,46,2025-03-23,0.35,7,328,2,A/MA/01275
"Apartment balcony (2A), Mar y Arte",23613433,Marqués De Guadiaro,Centro,Entire home/apt,110.0,2,68,2025-09-02,0.54,7,308,3,A/MA/01357
"Apart. sup. con balcón, Mar y Arte",23613433,Marqués De Guadiaro,Centro,Entire home/apt,121.0,2,6,2025-04-19,0.05,7,361,1,A/MA/01357
Modern apartment in the heart of historic centre,24922657,Samuel,Centro,Entire home/apt,86.0,4,143,2025-09-14,1.09,2,111,16,VFT/MA/01799
HEART OLD TOWN- Santos street,5895070,Miren Arantza,Centro,Entire home/apt,64.0,4,289,2025-09-29,2.21,3,79,35,
Apartment Málaga center,25221519,Eduardo,Centro,Entire home/apt,55.0,2,455,2025-09-16,3.55,3,123,46,VFT/MA/01068
San Felipe,19110429,Gary,Centro,Entire home/apt,110.0,4,101,2025-09-12,0.79,2,262,4,VUT/MA/02156
Apartamento de diseño en el centro.,14995276,Juanma,Centro,Entire home/apt,81.0,5,33,2025-09-24,0.26,4,251,6,VFT/MA/06336
"Charming, spacious & central",2986899,Andrés,Centro,Entire home/apt,63.0,4,348,2025-09-20,2.69,2,275,34,VFT/MA/08684
CASA EN HUELIN - PLAYA A 350 METROS,25807328,Edouard,Carretera de Cadiz,Entire home/apt,139.0,5,84,2025-09-12,1.84,1,164,20,CTC-2019 225110
Stylish 2 bedroom  in Malaga Center,16663600,Maria,Centro,Entire home/apt,120.0,4,96,2025-09-13,0.75,6,109,10,ESFCTU0000290200007289450000000000000000VFT/MA/039028
Victoria 13- F. FreshApartments,3376700,Freshlanding,Centro,Entire home/apt,80.0,1,76,2025-07-09,0.6,59,311,1,VFT/MA/01197; ESFCTU0000290270005493960000000000000000VFT/MA/011978
Frailes  3A  FreshApartments,3376700,Freshlanding,Centro,Entire home/apt,76.0,1,124,2025-09-11,0.98,59,341,15,VFT/-MA/132
Frailes 1A  FreshApartments,3376700,Freshlanding,Centro,Entire home/apt,76.0,1,108,2025-08-30,0.83,59,342,15,VFT/-MA/132
Beautiful house next to the beach for groups,24396572,Jose Carlos,Este,Entire home/apt,407.0,3,135,2025-09-21,1.09,1,174,19,VFT/MA/06026
"Confortable, tranquilo y céntrico.",26160719,Catalina,Centro,Entire home/apt,74.0,2,514,2025-09-27,3.96,3,243,72,ESFCTU0000290220000130900000000000000000VFT/MA/027698
New luxury 1 bedr Malaga's Center,16663600,Maria,Centro,Entire home/apt,99.0,4,47,2025-07-28,0.37,6,237,15,ESFCTU0000290200007287090000000000000000VFT/MA/031761
Studio apartment in Malaga,10333494,Carlos,Este,Entire home/apt,63.0,7,34,2025-09-14,0.28,2,317,1,CTC-201665824
Nice apartment near downtown + Free Parking,25430691,Carlos,Centro,Entire home/apt,62.0,3,399,2025-09-24,3.1,1,193,57,ESFCTU0000290200007471060000000000000000VUT/MA/003826
Real spanish life in Malaga,26798879,Louise,Este,Entire home/apt,68.0,3,92,2025-06-15,0.72,1,239,6,CTC-2018080505
Bright Spacious Cozy Apt in Historic Malaga Shops,5344810,Brian,Centro,Entire home/apt,419.0,3,158,2025-06-23,1.26,6,63,4,CTC-2016144491
Apartamento en plaza de la merced. Centro Malaga.,14995276,Juanma,Centro,Entire home/apt,74.0,5,34,2025-08-24,0.27,4,344,10,VFT/MA/01111
Sunshine Studio! Culture & Relax in the Center,611895,Luis & Celeste,Centro,Entire home/apt,69.0,4,413,2025-09-22,3.27,2,111,42,ESFCTU0000290270005561720000000000000000VUT/MA/014813
Malaga city center,27063270,Mercedes,Centro,Entire home/apt,63.0,5,146,2025-08-20,1.15,1,31,14,ESFCTU0000290200006087110000000000000000VFT/MA/091543
Private Terrace&Parking Penthouse in Center,19614259,Cristian,Centro,Entire home/apt,139.0,4,154,2025-09-27,1.23,2,175,28,ESFCTU0000290270004822590000000000000000VUT/MA/788343
Apartment in Malaga Historic Centre,2489890,Fede,Centro,Entire home/apt,104.0,4,212,2025-08-25,1.66,13,41,19,VUT/MA/01615
Quiet Apartment Historical Center 2,22835439,Bruno,Centro,Entire home/apt,95.0,2,16,2025-05-04,0.12,16,189,1,A/MA/01382
Studio in Malaga Center,2489890,Fede,Centro,Entire home/apt,59.0,4,174,2025-09-11,1.36,13,65,10,ESFCTU0000290270005354120000000000000000VUT/MA/0006145
"Bright, central apartment with charm",6076011,Maria Dolores,Centro,Entire home/apt,78.0,5,78,2025-08-23,0.61,1,181,1,VFT/MA/02195
Apartamento  Centro Histórico 3,20326063,Ernesto,Centro,Entire home/apt,81.0,5,80,2025-09-14,0.66,4,256,25,VTF/MA/15335
Malaga Exclusive Penthouse Private Solarium Roof Terrace B,8544512,Malaga Center Flat,Centro,Entire home/apt,122.0,1,62,2025-08-24,0.48,59,297,4,VFT/MA/00751
Málaga city center.(Duplex +Apartment),12963003,Maria Jesus,Centro,Entire home/apt,180.0,1,47,2025-06-22,0.37,6,365,5,CTC-2018119025
Estudio azul céntrico con patio.,12963003,Maria Jesus,Centro,Entire home/apt,85.0,1,61,2025-09-14,0.49,6,319,4,CTC-2018119025
Centro duplex .Calle tranquila .Grupos.3 baños.,12963003,Maria Jesus,Centro,Entire home/apt,160.0,1,100,2025-09-28,0.8,6,361,9,CTC-2018119530
"Charming bright apt WIFI, Elevator, 4 Window, A/A",11318862,Maria Palma,Centro,Entire home/apt,133.0,4,138,2025-09-23,1.1,7,274,8,VUT/MA/01864
Apartamento centro histórico con fibra óptica,29016701,Álvaro,Centro,Entire home/apt,65.0,5,158,2025-09-11,1.66,2,175,37,VUT/MA/13617         ESFCTU0000290270005081400000000000000000VUT/MA/136173
New apartment in the center.,29103612,Sheila,Centro,Entire home/apt,70.0,3,159,2025-06-26,1.25,1,59,12,VFT/MA/01268
Victoria de Alba House. Apartment 2,29329338,Antonio Jesús,Centro,Entire home/apt,93.0,1,131,2025-07-22,1.03,2,227,5,ESFCTU00A0290270000163550000000000000000VFT/MA/084852
Lovely flat  Old Town Private Parking free,14922045,Jorge,Centro,Entire home/apt,72.0,4,366,2025-09-11,3.02,3,333,58,ESFCTU0000290270005119660000000000000000VFT/MA/002077
Loft céntrico y tranquilo.,26160719,Catalina,Centro,Entire home/apt,76.0,2,356,2025-09-22,2.79,3,231,50,ESFCTU0000290220000130900000000000000000VFT/MA/027698
M&M Malaga apartment,29810968,M&M,Centro,Entire home/apt,103.0,2,447,2025-09-25,3.5,1,255,54,ESFCTU0000290200007455390000000000000000VFT/MA/003485
Luxury appart. with 3 double rooms,25731522,Alberto Jose,Centro,Entire home/apt,222.0,5,68,2025-09-21,0.54,1,237,32,VFT/MA/66674
New apartment in the city center,1807742,Débora,Centro,Entire home/apt,81.0,2,212,2025-08-21,1.66,1,0,13,ESFCTU0000290270004952420000000000000000VFT/MA/265050
Double bedroom private bathroom 15 min to old town,9732526,Nacho,Centro,Private room,41.0,3,576,2025-09-11,4.51,1,163,50,VFT/MA/00926
"Villa Salud, primer piso",30595775,Ana María,Centro,Entire home/apt,150.0,4,12,2025-08-30,0.36,2,62,4,VFT/MA/13396   Número de registro único: ESFCTU0000290200007320100000000000000000VFT/MA/133960
"Maison entière,avec jacuzzi.Totalement équipée.",30780647,Claudine,Churriana,Entire home/apt,77.0,5,22,2025-07-29,0.34,2,157,4,CTC-201625305
"B&B indépendant,double vitrage,aéroport Málaga AGP",30780647,Claudine,Churriana,Private room,55.0,1,419,2025-09-15,3.68,2,283,66,CTC-201625289
Pedregalejos playa 2 habitaciones,31088953,Jose Maria,Este,Entire home/apt,89.0,2,57,2025-09-14,0.55,8,285,10,ESFCTU000029020000761256000000000000000000A/MA/016655
So Clean Low Cost Apartment at city centre no bars,30149500,Martin,Centro,Entire home/apt,78.0,2,396,2025-09-29,3.18,2,39,57,VFT/MA 04518
"In the center,Free private parking,cosy,2room,wifi",25961901,"Isabel, Gloria Y Francisco",Centro,Entire home/apt,100.0,2,517,2025-09-11,4.21,1,307,49,RTA-02068
Unique & Smart Loft Malaga centre!,31130279,Zeljko,Centro,Entire home/apt,75.0,5,305,2025-09-13,2.46,1,152,26,VTF/MA/04113
En pleno centro de Málaga  2di,17585280,Pablo Y Marisa,Centro,Entire home/apt,112.0,7,56,2025-07-03,0.45,15,345,2,ESFCTU000029027000011343000000000000000000A/MA/013342
Lovely Flat at the Historic Center,32285652,Ramon,Centro,Entire home/apt,95.0,2,696,2025-09-16,5.56,1,145,84,CCAA VFT/MA/02093
Malaga Exclusive Penthouse Private Solarium Roof Terrace A,8544512,Malaga Center Flat,Centro,Entire home/apt,122.0,1,27,2025-06-27,0.24,59,338,4,VFT/MA/00748
Sea views - city centre - Home VUT/MA/01282,26583926,Patricio,Centro,Entire home/apt,290.0,2,143,2025-09-03,1.14,3,1,21,ESFCTU0000290200004972850000000000000000VUT/MA/012828
"PISCINE,TERRACE,free parking,wifi,air cond,subway",8968582,Antonio Miguel,Teatinos-Universidad,Entire home/apt,79.0,10,26,2025-09-07,1.89,3,193,20,VFT/MA/30163. Nacional: ESFCTU0000290260006756230000000000000000VFT/MA/301637
"City center next to the beach, 3 bedrooms",2707228,Alfonso,Carretera de Cadiz,Entire home/apt,136.0,5,41,2025-09-04,0.33,5,144,5,VFT/MA/1338
Apartment with sea views - Malaga,13172203,Marta,Centro,Entire home/apt,100.0,2,208,2025-08-18,1.68,4,172,7,VFT/MA/01913
Apartment in the Old City of Málaga,33655805,Miguel,Centro,Entire home/apt,78.0,5,276,2025-09-20,2.22,1,156,34,VFT/MA/00821 ESFCTU0000290200007468260000000000000000VFT/MA/008213
